[
  {
    "request_id": "req-1",
    "ts_ns": 1767571200000000000,
    "instrument": "SIM-BTC",
    "best_bid": "65000.0",
    "best_ask": "65000.1",
    "mid": "65000.05",
    "spread_ticks": 1,
    "features": { "imbalance": 0.2 },
    "signal": {
      "direction": "up",
      "probs": [0.1, 0.2, 0.7],
      "model_sha256": "e3b0c44298fc1c149afbf4c8996fb92427ae41e4649b934ca495991b7852b855"
    },
    "position": "0",
    "limits": {
      "max_position": "10",
      "max_notional": "100000",
      "max_order_rate_per_sec": 5,
      "remaining_daily_loss": "1000"
    },
    "allowed_actions": ["buy", "sell", "no_trade"]
  },
  {
    "request_id": "req-2",
    "ts_ns": 1767571201000000000,
    "instrument": "SIM-BTC",
    "best_bid": "65000.2",
    "best_ask": "65000.3",
    "mid": "65000.25",
    "spread_ticks": 1,
    "features": { "imbalance": 0.0 },
    "signal": {
      "direction": "flat",
      "probs": [0.3, 0.4, 0.3],
      "model_sha256": "e3b0c44298fc1c149afbf4c8996fb92427ae41e4649b934ca495991b7852b855"
    },
    "position": "0",
    "limits": {
      "max_position": "10",
      "max_notional": "100000",
      "max_order_rate_per_sec": 5,
      "remaining_daily_loss": "1000"
    },
    "allowed_actions": ["buy", "sell", "no_trade"]
  }
]
